{
  "title": "1-Bit Full Adder",
  "education": {
    "summary": "Two XOR gates make the sum bit and two ANDs plus an OR make the carry.",
    "objectives": [
      "Read a logic schematic",
      "Build a truth table",
      "Chain adders for wider numbers"
    ],
    "theory": "S = A ⊕ B ⊕ Cin, Cout = A·B + (A ⊕ B)·Cin.",
    "questions": [
      "Fill in the truth table for all eight input combinations.",
      "How many gates does a 4-bit adder need?"
    ]
  },
  "components": [
    {
      "id": "A",
      "type": "input"
    },
    {
      "id": "B",
      "type": "input"
    },
    {
      "id": "CIN",
      "type": "input"
    },
    {
      "id": "U1",
      "type": "xor"
    },
    {
      "id": "U2",
      "type": "xor"
    },
    {
      "id": "U3",
      "type": "and"
    },
    {
      "id": "U4",
      "type": "and"
    },
    {
      "id": "U5",
      "type": "or"
    },
    {
      "id": "SUM",
      "type": "output"
    },
    {
      "id": "COUT",
      "type": "output"
    }
  ],
  "connections": [
    [
      "A",
      "U1.A",
      "U3.A"
    ],
    [
      "B",
      "U1.B",
      "U3.B"
    ],
    [
      "U1.Y",
      "U2.A",
      "U4.A"
    ],
    [
      "CIN",
      "U2.B",
      "U4.B"
    ],
    [
      "U2.Y",
      "SUM"
    ],
    [
      "U3.Y",
      "U5.B"
    ],
    [
      "U4.Y",
      "U5.A"
    ],
    [
      "U5.Y",
      "COUT"
    ]
  ]
}
