{
  "title": "Minimal Microcontroller System",
  "education": {
    "summary": "A minimal MCU system: decoupling, a reset pull-up with a button, a crystal with its load capacitors, and an LED on a port pin.",
    "objectives": [
      "List what an MCU needs to run",
      "Explain crystal load capacitors",
      "Size an LED resistor for a port pin"
    ],
    "questions": [
      "Why does the crystal need two capacitors to ground?",
      "What does the 100 nF capacitor do?"
    ],
    "troubleshooting": [
      "MCU keeps resetting: check the decoupling capacitor and the reset pull-up."
    ]
  },
  "components": [
    {
      "id": "U1",
      "type": "microcontroller",
      "value": "ATmega328P"
    },
    {
      "id": "Y1",
      "type": "crystal",
      "value": "16MHz"
    },
    {
      "id": "C1",
      "type": "capacitor",
      "value": "22pF"
    },
    {
      "id": "C2",
      "type": "capacitor",
      "value": "22pF"
    },
    {
      "id": "R1",
      "type": "resistor",
      "value": "10kΩ"
    },
    {
      "id": "SW1",
      "type": "push_button",
      "value": "RESET"
    },
    {
      "id": "R2",
      "type": "resistor",
      "value": "330Ω"
    },
    {
      "id": "D1",
      "type": "led"
    },
    {
      "id": "C3",
      "type": "capacitor",
      "value": "100nF"
    },
    {
      "id": "VCC",
      "type": "vcc",
      "value": "+5V"
    },
    {
      "id": "GND",
      "type": "ground"
    }
  ],
  "connections": [
    [
      "U1.VCC",
      "VCC"
    ],
    [
      "U1.GND",
      "GND"
    ],
    [
      "C3.1",
      "VCC"
    ],
    [
      "C3.2",
      "GND"
    ],
    [
      "U1.RST",
      "R1.2",
      "SW1.1"
    ],
    [
      "R1.1",
      "VCC"
    ],
    [
      "SW1.2",
      "GND"
    ],
    [
      "U1.XTAL1",
      "Y1.1",
      "C1.1"
    ],
    [
      "U1.XTAL2",
      "Y1.2",
      "C2.1"
    ],
    [
      "C1.2",
      "GND"
    ],
    [
      "C2.2",
      "GND"
    ],
    [
      "U1.PB0",
      "R2.1"
    ],
    [
      "R2.2",
      "D1.anode"
    ],
    [
      "D1.cathode",
      "GND"
    ]
  ]
}
